{
  "$schema": "https://json-schema.org/draft/2020-12/schema",
  "$id": "https://raw.githubusercontent.com/redevrx/mangax-effects/main/schema/effect.schema.json",
  "title": "MangaX effect manifest (schema 1)",
  "description": "Editor help for effect.json. The app's ManifestValidator is the authority; this mirrors its rules.",
  "type": "object",
  "required": [
    "schema",
    "id",
    "version",
    "name",
    "type"
  ],
  "properties": {
    "$schema": {
      "type": "string"
    },
    "schema": {
      "const": 1
    },
    "id": {
      "type": "string",
      "maxLength": 100,
      "pattern": "^[a-z0-9][a-z0-9-]*(\\.[a-z0-9][a-z0-9-]*)+$",
      "description": "owner.effect-name. The redevrx. prefix installs only from github.com/redevrx."
    },
    "version": {
      "type": "string",
      "pattern": "^\\d+\\.\\d+\\.\\d+([-+][0-9A-Za-z.-]+)?$"
    },
    "name": {
      "$ref": "#/$defs/text"
    },
    "description": {
      "$ref": "#/$defs/text"
    },
    "author": {
      "type": "object",
      "required": [
        "name"
      ],
      "properties": {
        "name": {
          "type": "string"
        },
        "url": {
          "type": "string",
          "pattern": "^https://"
        }
      }
    },
    "type": {
      "enum": [
        "style",
        "action",
        "toggle"
      ]
    },
    "category": {
      "enum": [
        "reading",
        "cleanup",
        "appearance",
        "navigation",
        "utility"
      ]
    },
    "icon": {
      "description": "One of the Material icon names below, or an icon drawn from SVG path data in the one colour the app picks.",
      "oneOf": [
        {
          "enum": [
            "swap_vert",
            "block",
            "visibility_off",
            "dark_mode",
            "light_mode",
            "contrast",
            "palette",
            "speed",
            "timer",
            "text_fields",
            "format_size",
            "close",
            "bolt",
            "touch_app",
            "skip_next",
            "auto_fix_high",
            "menu_book",
            "auto_stories",
            "translate",
            "record_voice_over",
            "volume_up",
            "bookmark",
            "zoom_in",
            "fit_screen",
            "cleaning_services",
            "hide_image",
            "filter_alt",
            "delete_sweep",
            "do_not_disturb",
            "brightness_6",
            "invert_colors",
            "format_color_fill",
            "blur_on",
            "crop",
            "image",
            "wallpaper",
            "keyboard_double_arrow_down",
            "vertical_align_top",
            "arrow_downward",
            "swipe",
            "open_in_new",
            "link",
            "notifications",
            "download",
            "content_copy",
            "refresh",
            "settings",
            "pets",
            "emoji_emotions",
            "star",
            "favorite"
          ]
        },
        {
          "type": "object",
          "required": ["paths"],
          "additionalProperties": false,
          "properties": {
            "viewBox": {
              "description": "SVG's \"x y width height\", or one number for a square from 0,0. Default 24.",
              "oneOf": [
                { "type": "number", "exclusiveMinimum": 0 },
                { "type": "string", "pattern": "^\\s*-?[0-9.eE+-]+([\\s,]+-?[0-9.eE+-]+){3}\\s*$" }
              ]
            },
            "paths": {
              "type": "array",
              "minItems": 1,
              "maxItems": 8,
              "items": { "type": "string", "pattern": "^\\s*[Mm][MmZzLlHhVvCcSsQqTtAa0-9.,+\\-eE\\s]*$" }
            },
            "fillRule": { "enum": ["nonzero", "evenodd"] }
          }
        }
      ]
    },
    "entry": {
      "$ref": "#/$defs/file"
    },
    "style": {
      "$ref": "#/$defs/file"
    },
    "runAt": {
      "enum": [
        "manual",
        "pageLoad",
        "documentStart"
      ]
    },
    "matches": {
      "type": "array",
      "minItems": 1,
      "items": {
        "$ref": "#/$defs/pattern"
      }
    },
    "excludes": {
      "type": "array",
      "items": {
        "$ref": "#/$defs/pattern"
      }
    },
    "engines": {
      "type": "array",
      "minItems": 1,
      "items": {
        "enum": [
          "any",
          "manga",
          "novel"
        ]
      }
    },
    "permissions": {
      "type": "array",
      "items": {
        "enum": [
          "toast",
          "menu",
          "engine",
          "companion"
        ]
      }
    },
    "keywords": {
      "type": "array",
      "maxItems": 20,
      "items": {
        "type": "string",
        "maxLength": 40
      },
      "description": "Extra words the market search matches, in any language."
    },
    "companion": {
      "type": "object",
      "description": "A second page the effect opens beside the one being read and runs mangax.companion(fn) in. Needs the companion permission.",
      "required": ["url"],
      "properties": {
        "url": { "type": "string", "pattern": "^https://" },
        "matches": { "type": "array", "items": { "$ref": "#/$defs/pattern" } }
      }
    },
    "settingsUi": {
      "type": "boolean",
      "description": "The script draws its own settings on the page with mangax.settings(fn); the sheet shows a settings button."
    },
    "options": {
      "type": "array",
      "maxItems": 20,
      "items": {
        "$ref": "#/$defs/option"
      }
    },
    "minApp": {
      "type": "string"
    },
    "homepage": {
      "type": "string",
      "pattern": "^https://"
    }
  },
  "allOf": [
    {
      "if": {
        "properties": {
          "type": {
            "const": "style"
          }
        }
      },
      "then": {
        "required": [
          "style"
        ],
        "not": {
          "required": [
            "entry"
          ]
        }
      }
    },
    {
      "if": {
        "properties": {
          "type": {
            "const": "action"
          }
        }
      },
      "then": {
        "required": [
          "entry"
        ],
        "not": {
          "required": [
            "style"
          ]
        }
      }
    },
    {
      "if": {
        "properties": {
          "type": {
            "const": "toggle"
          }
        }
      },
      "then": {
        "required": [
          "entry"
        ]
      }
    }
  ],
  "$defs": {
    "text": {
      "oneOf": [
        {
          "type": "string",
          "minLength": 1
        },
        {
          "type": "object",
          "minProperties": 1,
          "additionalProperties": {
            "type": "string"
          }
        }
      ]
    },
    "file": {
      "type": "string",
      "maxLength": 200,
      "pattern": "^(?!/)(?!.*(^|/)\\.\\.?(/|$))[A-Za-z0-9._@+/-]+$"
    },
    "pattern": {
      "type": "string",
      "pattern": "^(<all_urls>|(\\*|https?)://(\\*|\\*\\.[^/*]+|[^/*]+)/.*)$"
    },
    "option": {
      "type": "object",
      "required": [
        "key",
        "type",
        "label"
      ],
      "properties": {
        "key": {
          "type": "string",
          "pattern": "^[A-Za-z][A-Za-z0-9_]{0,39}$"
        },
        "type": {
          "enum": [
            "boolean",
            "slider",
            "select",
            "text"
          ]
        },
        "label": {
          "$ref": "#/$defs/text"
        }
      },
      "allOf": [
        {
          "if": {
            "properties": {
              "type": {
                "const": "boolean"
              }
            }
          },
          "then": {
            "properties": {
              "default": {
                "type": "boolean"
              }
            }
          }
        },
        {
          "if": {
            "properties": {
              "type": {
                "const": "slider"
              }
            }
          },
          "then": {
            "required": [
              "min",
              "max",
              "default"
            ],
            "properties": {
              "min": {
                "type": "number"
              },
              "max": {
                "type": "number"
              },
              "step": {
                "type": "number",
                "exclusiveMinimum": 0
              },
              "default": {
                "type": "number"
              },
              "unit": {
                "type": "string"
              }
            }
          }
        },
        {
          "if": {
            "properties": {
              "type": {
                "const": "select"
              }
            }
          },
          "then": {
            "required": [
              "default"
            ],
            "properties": {
              "dynamic": {
                "type": "boolean",
                "description": "Any string up to 200 characters is kept; the choices are only known on the page."
              },
              "choices": {
                "type": "array",
                "items": {
                  "type": "object",
                  "required": [
                    "value",
                    "label"
                  ],
                  "properties": {
                    "value": {
                      "type": "string"
                    },
                    "label": {
                      "$ref": "#/$defs/text"
                    }
                  }
                }
              },
              "default": {
                "type": "string"
              }
            }
          }
        },
        {
          "if": {
            "properties": {
              "type": {
                "const": "text"
              }
            }
          },
          "then": {
            "properties": {
              "default": {
                "type": "string"
              },
              "placeholder": {
                "$ref": "#/$defs/text"
              },
              "maxLength": {
                "type": "integer",
                "minimum": 1,
                "maximum": 2000
              }
            }
          }
        }
      ]
    }
  }
}
