{
  "$schema": "../../schema/effect.schema.json",
  "schema": 1,
  "id": "redevrx.webtoon-age-limit",
  "version": "1.1.0",
  "name": { "en": "Age Limit Popup", "th": "หน้าต่างอายุ" },
  "description": { "en": "Hide Webtoon's 18+ content warning dialog", "th": "ซ่อนคำเตือนอายุ 18+" },
  "author": { "name": "redevrx", "url": "https://github.com/redevrx" },
  "type": "toggle",
  "category": "cleanup",
  "icon": "block",
  "entry": "main.js",
  "matches": ["*://*.webtoons.com/*"],
  "engines": ["any"],
  "permissions": [],
  "keywords": ["webtoon", "age limit", "18+", "warning", "popup"],
  "options": []
}
